{
  "protocol": "crdd-ir/conformance-v0.1",
  "operation": "CreateEntity",
  "traces": [
    "REQ-ENTITY-001",
    "DEC-ENTITY-003"
  ],
  "cases": [
    {
      "id": "create-entity-success",
      "description": "CreateEntity succeeds when every precondition is satisfied",
      "request": {
        "input": {
          "length": 1,
          "cost": 1
        },
        "state": {
          "budget": {
            "remaining": 1000000
          },
          "entities": []
        }
      },
      "expected": {
        "ok": true,
        "operation": "CreateEntity",
        "state": {
          "budget": {
            "remaining": 999999
          },
          "entities": [
            {
              "length": 1,
              "cost": 1
            }
          ]
        },
        "traces": [
          "REQ-ENTITY-001",
          "DEC-ENTITY-003"
        ]
      }
    },
    {
      "id": "minimum-entity-length-at-boundary",
      "description": "length equal to 0.3 is accepted",
      "sourceRequirement": "minimum-entity-length",
      "request": {
        "input": {
          "length": 0.3,
          "cost": 1
        },
        "state": {
          "budget": {
            "remaining": 1000000
          },
          "entities": []
        }
      },
      "expected": {
        "ok": true,
        "operation": "CreateEntity",
        "state": {
          "budget": {
            "remaining": 999999
          },
          "entities": [
            {
              "length": 0.3,
              "cost": 1
            }
          ]
        },
        "traces": [
          "REQ-ENTITY-001",
          "DEC-ENTITY-003"
        ]
      }
    },
    {
      "id": "minimum-entity-length-below-boundary",
      "description": "length below 0.3 is rejected without state changes",
      "sourceRequirement": "minimum-entity-length",
      "request": {
        "input": {
          "length": 0.299,
          "cost": 1
        },
        "state": {
          "budget": {
            "remaining": 1000000
          },
          "entities": []
        }
      },
      "expected": {
        "ok": false,
        "operation": "CreateEntity",
        "error": "ENTITY_TOO_SHORT",
        "failedRequirement": "minimum-entity-length",
        "state": {
          "budget": {
            "remaining": 1000000
          },
          "entities": []
        },
        "traces": [
          "REQ-ENTITY-001"
        ]
      }
    },
    {
      "id": "sufficient-budget-exact",
      "description": "budget.remaining equal to cost is accepted",
      "sourceRequirement": "sufficient-budget",
      "request": {
        "input": {
          "length": 1,
          "cost": 1
        },
        "state": {
          "budget": {
            "remaining": 1
          },
          "entities": []
        }
      },
      "expected": {
        "ok": true,
        "operation": "CreateEntity",
        "state": {
          "budget": {
            "remaining": 0
          },
          "entities": [
            {
              "length": 1,
              "cost": 1
            }
          ]
        },
        "traces": [
          "REQ-ENTITY-001",
          "DEC-ENTITY-003"
        ]
      }
    },
    {
      "id": "sufficient-budget-insufficient",
      "description": "budget.remaining one unit below cost is rejected without state changes",
      "sourceRequirement": "sufficient-budget",
      "request": {
        "input": {
          "length": 1,
          "cost": 1
        },
        "state": {
          "budget": {
            "remaining": 0
          },
          "entities": []
        }
      },
      "expected": {
        "ok": false,
        "operation": "CreateEntity",
        "error": "INSUFFICIENT_BUDGET",
        "failedRequirement": "sufficient-budget",
        "state": {
          "budget": {
            "remaining": 0
          },
          "entities": []
        },
        "traces": [
          "DEC-ENTITY-003"
        ]
      }
    }
  ]
}
